{
  "id": "aero-data-for-hq-perform-improved",
  "type": "task",
  "name": "Aero data for HQ, Perfo",
  "description": "",
  "start": "2027-05-29",
  "end": "2027-07-24",
  "discipline": "aerodynamic-data",
  "row": 1,
  "predecessors": [
    "f100-aero-shape-improvements"
  ],
  "status": "planned",
  "tags": []
}
