{
  "id": "preliminary-flight-loads-primary-structure",
  "type": "task",
  "name": "Preliminary flight loads for primary structure",
  "description": "",
  "start": "2026-12-23",
  "end": "2027-02-27",
  "predecessors": [
    "mass-and-cog-estimate"
  ],
  "status": "planned",
  "tags": [],
  "row": 2,
  "discipline": "flight-loads"
}
