{
  "id": "new-task-1781727460159",
  "type": "task",
  "name": "Evaluate Handling qualities",
  "description": "",
  "start": "2028-05-24",
  "end": "2028-07-16",
  "predecessors": [
    "wind-tunnel-validated-aero-data",
    "new-task-1781727639299"
  ],
  "status": "planned",
  "tags": [],
  "row": 7,
  "discipline": "handling-qualities"
}
