{
  "id": "primary-control-surfaces-shape-design",
  "type": "task",
  "name": "Primary Control surfaces shape design",
  "description": "",
  "start": "2028-01-30",
  "end": "2028-03-22",
  "discipline": "aerodynamic-design",
  "row": 0,
  "predecessors": [
    "control-surfaces-final-sizing"
  ],
  "status": "planned",
  "tags": []
}
