{
  "id": "in-flight-handling-qualities-methodology",
  "type": "task",
  "name": "In flight handling qualities methodology ",
  "description": "",
  "start": "2026-11-03",
  "end": "2027-02-21",
  "predecessors": [],
  "status": "planned",
  "tags": [],
  "row": 7,
  "discipline": "handling-qualities"
}
