{
  "id": "flight-loads",
  "type": "task",
  "name": "Flight Design Loads (manoeuvre and gust)",
  "description": "Development of manoeuvre and gust load cases for primary structure and overall aircraft loads envelope.",
  "start": "2028-06-12",
  "end": "2028-10-13",
  "predecessors": [
    "new-deliverable-1781812830388",
    "new-deliverable-1781814662390"
  ],
  "status": "planned",
  "assignee": "Flight Physics",
  "tags": [
    "aircraft-design",
    "task",
    "loads",
    "flight-physics"
  ],
  "row": 2,
  "discipline": "flight-loads"
}
