{
  "id": "reverse-engineer-cl415",
  "type": "deliverable",
  "name": "Validate engineering methods on CL-415 reverse engineering",
  "description": "Validate engineering methods with CL415 reverse engineering: estimated handling qualities, performance should match with Aircraft flight manual, simulator etc",
  "date": "2027-05-16",
  "predecessors": [
    "gather-cl415-engineering-info",
    "validate-cl415-handling-qualities"
  ],
  "status": "planned",
  "tags": [
    "aircraft-design",
    "deliverable",
    "concept-review",
    "reverse-engineering",
    "CL-415"
  ],
  "row": 10,
  "discipline": "overall-aircraft-design",
  "subrow": 2
}
