{
  "id": "preliminary-water-loads",
  "type": "task",
  "name": "Preliminary water loads (hand calculation)",
  "description": "",
  "start": "2026-12-24",
  "end": "2027-02-28",
  "predecessors": [
    "mass-and-cog-estimate"
  ],
  "status": "planned",
  "tags": [],
  "row": 4,
  "discipline": "water-loads"
}
