{
  "id": "new-task-1781729592942",
  "type": "task",
  "name": "Aero data for HQ, Perform",
  "description": "",
  "start": "2027-02-01",
  "end": "2027-03-22",
  "predecessors": [
    "new-task-1781729174012"
  ],
  "status": "planned",
  "tags": [],
  "row": 1,
  "discipline": "aerodynamic-data",
  "subrow": 0
}
