{
  "id": "evaluate-handling-qualities",
  "type": "task",
  "name": "Evaluate Handling qualities",
  "description": "",
  "start": "2028-05-24",
  "end": "2028-07-16",
  "predecessors": [
    "control-surfaces-final-sizing",
    "aero-data-for-hq-perfo-loads"
  ],
  "status": "planned",
  "tags": [],
  "row": 7,
  "discipline": "handling-qualities"
}
