{
  "id": "aero-data-for-hq-perform-concept",
  "type": "task",
  "name": "Aero data for HQ, Perform",
  "description": "",
  "start": "2027-02-01",
  "end": "2027-03-22",
  "predecessors": [
    "f100-aero-shape-design"
  ],
  "status": "planned",
  "tags": [],
  "row": 1,
  "discipline": "aerodynamic-data",
  "subrow": 0
}
