{
  "id": "design-loads-methodology-flight",
  "type": "task",
  "name": "Design Loads methodology - Flight",
  "description": "Design Loads methodology",
  "start": "2027-08-21",
  "end": "2027-11-19",
  "predecessors": [],
  "status": "planned",
  "tags": [],
  "row": 2,
  "discipline": "flight-loads"
}
