{
  "id": "new-task-1781729363543",
  "type": "task",
  "name": "Evaluate F100 performance",
  "description": "",
  "start": "2027-03-22",
  "end": "2027-05-14",
  "predecessors": [
    "new-task-1781729592942",
    "new-deliverable-1781732212078"
  ],
  "status": "planned",
  "tags": [],
  "row": 6,
  "discipline": "performance"
}
