{
  "id": "ground-water-loads",
  "type": "task",
  "name": "Ground and water design loads",
  "description": "Development of landing, ground handling, and water operation load cases.",
  "start": "2028-06-12",
  "end": "2028-10-13",
  "predecessors": [
    "new-task-1781728461373"
  ],
  "group": "loads",
  "status": "planned",
  "assignee": "Flight Physics",
  "tags": [
    "aircraft-design",
    "task",
    "loads",
    "flight-physics"
  ],
  "row": 3
}
