{
  "id": "backend",
  "type": "task",
  "name": "Backend build",
  "description": "API, persistence, and background jobs.",
  "start": "2026-07-07",
  "end": "2026-08-15",
  "predecessors": ["design-review"],
  "group": "implementation",
  "status": "planned",
  "assignee": "Backend Team",
  "tags": ["development", "phase-2"]
}
